{
  "schema_version": "0.1",
  "idempotency_key": "evt-0002-lrn_0a1b2c3d4e5f6071-crt_findings_clarity",
  "source_system": "sandbox",
  "event_type": "criterion_result",
  "learner_id": "lrn_0a1b2c3d4e5f6071",
  "competency_id": "cmp_data_analysis",
  "level": 3,
  "criterion_id": "crt_findings_clarity",
  "method": "ai_judged",
  "outcome": "partial",
  "score": 0.6,
  "confidence": 0.58,
  "ai_disclosure": true,
  "model_ref": "provider-model-2026-09",
  "task_id": "tsk_sales_dedupe",
  "task_version": "1.0.0",
  "rubric_id": "rbr_data_analysis",
  "rubric_version": "1.0.0",
  "seed_id": "sd_9f8e7d6c5b4a",
  "submission_ref": "sha256:bbbbbbbbbbbbbbbbbbbbbbbbbbbbbbbbbbbbbbbbbbbbbbbbbbbbbbbbbbbbbbbb",
  "rationale": "Recommendation present but not tied to the figures reported.",
  "flags": ["low_confidence"],
  "occurred_at": "2026-10-10T09:22:00Z"
}
